ProductNumber,ProductArName,ProductEnName,BrandName,CounrtyEn,PackageVolume,UnitEn,manufactureenglishname,ListedNameEn
2016-0140114-039522,معجون أسنان كولجيت ثقة الانتعاش النعناع جل,Colgate toothpaste FRESH CONFIDENCE Mint Gel ,Colgate,Kingdom of Saudi Arabia,125,Milliliter (ml),Colgate Palmolive Arabia LTD,Colgate Palmolive Arabia
2017-0140114-060844,هيمالايا أعشاب معجون أسنان،عشبي  لبياض براق,himalaya herbals toothpaste sparkly white herbal ,himalaya herbals,United Arab Emirates,100,Milliliter (ml),Soap and Chemicals Industrial & Trading Company ,Sara Group Holding
2016-0140124Code4-033912,أوليريكس أورال كير سبراي,OLIREX ORAL CARE SPRAY,OLIREX,South Korea,30,Milliliter (ml),"AJU PHARM CO.,LTD",ALHILAL TRADING CO
2016-0140114-034003,أتوميك,Lush Atomic Toothy Tabs,LUSH,United Kingdom,12,Gram (g),Lush Manufacturing Limited,Lush Mena Trading Est
2016-0140114-034053,بلينغ!,Lush Bling! golden toothy tabs ,Lush,United Kingdom,50,Gram (g),Lush Manufacturing Limited,Lush Mena Trading Est
2016-0140124-040685,كليفرش غسول للفم,CLEFRESH MOUTH WASH,CLEFRESH,Kingdom of Saudi Arabia,300,Milligram )mg(,ARAB CHEMISTS CO FOR COSMETICS AND MEDICAL INDUSTR,Abhaa cosmetic manufacture   ACM
2016-0140124-041464,جنجي ماكس غسول للفم,GINGI MAX mouth wash,GINGI MAX mouth wash,Kingdom of Saudi Arabia,300,Milliliter (ml),ARAB CHEMISTS CO FOR COSMETICS AND MEDICAL INDUSTR,Abhaa cosmetic manufacture   ACM
2016-0140124-042215, كليمو غسول فم منعش لرائحة الفم,Clemo MOUTH WASH Refreshing To Halitosis,Clemo ,Kingdom of Saudi Arabia,240,Milliliter (ml),Mohammed Salim Alkahwaji factory for Cosmetics,MOHAMMAD SALIM ALKAHWAJI FACTORY FORCOSMETICS &SHA
2016-0140114-043167,معجون أسنان سواك – إف شنطة للأطفال بنكهة الفراولة ,Siwak-F Toothpaste Junior Bag Starwbery 50 gram,siwak.f,Saudi Arabia,50,Gram (g),Said Salim Bawazir For Toothpaste & Sweetener Fact,Said Salim Bawazir For Toothpaste & Sweetener Fact
2016-0140124-043785,سمارتين غسول للفم ,smartinn mouth wash,smartinn,Saudi Arabia,300,Milliliter (ml),UNICARE FOR COSMETICS & Antiseptics ,unicare for cosmetics & antisepticsa
2016-0140124-045116,هاى كير بلس - غسول فم,HI care plus - Mouth Wash,HI care plus - Mouth Wash,Saudi Arabia,300,Milliliter (ml),Sehr Alreef cosmetics factory,Alasriyah Academic Schools
2016-0140124-046069,يونيكير غسول للفم,unicare mouth wash,unicare ,Saudi Arabia,240,Milliliter (ml),UNICARE FOR COSMETICS & Antiseptics ,unicare for cosmetics & antisepticsa
2016-0140124-046274,ايفا - غسول فم ,EVA - mouth wash ,EVA ,Saudi Arabia,300,Milliliter (ml),Sehr Alreef cosmetics factory,Alasriyah Academic Schools
2016-0140114-046845,هاى سبت - معجون اسنان,HI sept - Tooth paste,HI sept,Saudi Arabia,100,Gram (g),Sehr Alreef cosmetics factory,Alasriyah Academic Schools
2016-0140124-046927,بروفينال غسول منعش للفم ,provinal mouth fresh,provinal  ,Saudi Arabia,300,Milliliter (ml),UNICARE FOR COSMETICS & Antiseptics ,unicare for cosmetics & antisepticsa
2016-0140124-047228,اورجل - جل,ORGEL - Gel,ORGEL ,Saudi Arabia,20,Milliliter (ml),Sehr Alreef cosmetics factory,Alasriyah Academic Schools
2016-0140124-047301,بلونول بلس - غسول فم,Blonol plus - mouth wash,Blonol plus,Saudi Arabia,300,Milliliter (ml),Sehr Alreef cosmetics factory,Alasriyah Academic Schools
2016-0140114-047656,هاى كير معجون اسان,Hi care Tooth paste,Hi care,Saudi Arabia,100,Gram (g),Sehr Alreef cosmetics factory,Alasriyah Academic Schools
2019-0140114-154133,دابر الأعشاب الحساس معجون الاسنان الطبيعي,Dabur Herb'l Sensitive Natural Toothpaste,Dabur Herb'l,United Arab Emirates,150,Gram (g),Naturelle LLc,ARAB TRADING -TAMER GROUP
2019-0140114-154174,سنترو دينتال كيت,Centro Dental Kit,Centro Dental Kit,China,6,Gram (g),Yangzhou Olande Cosmetics Co. Ltd,Rasheed abdulaziz alrasheed printing press
2019-0140114-154175,"إيموفورم -إف ,للأسنان الحساسه بالفلورايد",EMOFORM-F SENSITIVE,EMOFORM,Egypt,50,Milliliter (ml),SESIC,Middle East Drug Store
2019-0140114-154175,"إيموفورم -إف ,للأسنان الحساسه بالفلورايد",EMOFORM-F SENSITIVE,EMOFORM,Egypt,85,Milliliter (ml),SESIC,Middle East Drug Store
2019-0140114-154176,إيموفورم للعناية باللثة,EMOFORM Gum Care,EMOFORM,Egypt,85,Milliliter (ml),SESIC,Middle East Drug Store
2019-0140114-154176,إيموفورم للعناية باللثة,EMOFORM Gum Care,EMOFORM,Egypt,50,Milliliter (ml),SESIC,Middle East Drug Store
2019-0140114-154195,كلوس اب إنتعاش النعناع مع  فرشة اسنان مجانية,CLOSE UP MENTHOL+TOOTHBRUSH 4,CLOSE UP,Egypt,120,Milliliter (ml),Unilever Mashreq for Personal Care,Binzager Unilever Distribution Company Limited
2019-0140114-154256,معجون أسنان بيضاء على الفور,WHITE NOW toothpaste,CLOSE UP,Egypt,75,Milliliter (ml),Unilever Mashreq for Personal Care,Binzager Unilever Distribution Company Limited
2019-0140114-154258,كلوس اب معجون اسنان  دايموند اتراكشن,close up toothpaste Diamond Attraction power white,CLOSE UP,Egypt,75,Milliliter (ml),Unilever Mashreq for Personal Care,Binzager Unilever Distribution Company Limited
2019-0140114-154259,كلوس اب أحمر حار مع فرشة اسنان مجانية,CLOSE UP RED HOT+TOOTHBRUSH ,CLOSE UP,Egypt,120,Milliliter (ml),Unilever Mashreq for Personal Care,Binzager Unilever Distribution Company Limited
2018-0140124-102592,بيلاسيل غسول للعناية بالفم بطعم النعناع, belaCell Mouth Wash peppermentflavored,belaCell,Egypt,250,Milliliter (ml), 	Kempetro Chemical Industries Pharmaceutical & Co,alqubbany pharmacy 5
2016-0140114-034321,هيمالايا بوتانيك معجون أسنان مبيض لعناية كاملة  أو,Himalaya Botanique Whitening CCToothPASTE PEPPERMI,Himalaya Botanique,India,150,Milliliter (ml),The Himalaya Drug Company,Sara Group Holding
2017-0140114-061086,مايلز اوف سمايلز,Lush Miles of Smiles Toothy Tabs,LUSH,United Kingdom,50,Gram (g),Lush Manufacturing Limited,alsaati medical grup
2019-014015401541-136524,إيفز تشيري,Lush Eve's Cherry Lip Scrub,LUSH,United Kingdom,25,Gram (g),Lush Manufacturing Limited,alsaati medical grup
2016-0140114-047917,دنتا كول جل منعش للفم ,denta cool oral refreshing gel,denta cool ,Saudi Arabia,30,Milliliter (ml),UNICARE FOR COSMETICS & Antiseptics ,unicare for cosmetics & antisepticsa
2016-0140114-048596,كلوس اب معجون اسنان ديب اكشن احمر حار,close up toothpaste deep action red hot,close up,Saudi Arabia,120,Milliliter (ml),Binzagr Unilever Ltd.,Binzager Unilever LTD
2016-0140124-049067,أكتف غسول للفم,Active mouth wash,Active,Saudi Arabia,250,Milliliter (ml),UNICARE FOR COSMETICS & Antiseptics ,unicare for cosmetics & antisepticsa
2016-0140114-049113,ريفريش - معجون اسنان,REfresh - Tooth paste,REfresh - Tooth paste,Saudi Arabia,100,Gram (g),Sehr Alreef cosmetics factory,Alasriyah Academic Schools
2016-0140124-049449,روفا فريش غسول للفم,Rova Fresh mouth wash,Rova Fresh,Saudi Arabia,300,Milliliter (ml),UNICARE FOR COSMETICS & Antiseptics ,unicare for cosmetics & antisepticsa
2017-0140124-052210,اوراسين بلس - غسول فم,Oracin plus - mouth wash,Oracin plus,Saudi Arabia,120,Milliliter (ml),Sehr Alreef cosmetics factory,Alasriyah Academic Schools
2017-0140124-052321,رومـــاثول غسول المضمضة بنكهة النعناع وِشجرة الشاي,Rheumathol Mouthwash with tea tree and mint flavor,Rheumathol,Saudi Arabia,250,Milliliter (ml),Health and Beauty for cosmetic products,Health and Beauty Factorty for cosmetic Products
2017-0140124-052437,جينفورال جل منعش للفم,Ginvoral mouth refreshing gel,Ginvoral,Saudi Arabia,30,Milliliter (ml),UNICARE FOR COSMETICS & Antiseptics ,unicare for cosmetics & antisepticsa
2017-0140124-053303,هيكسدين غسول للفم,Hixidin mouth wash,Hixidin,Saudi Arabia,240,Milliliter (ml),UNICARE FOR COSMETICS & Antiseptics ,unicare for cosmetics & antisepticsa
2017-0140124Code5-054163,كليدنت جل معطر للفم,CLEDENT refreshing gel,CLEDENT ,Kingdom of Saudi Arabia,30,Gram (g),ARAB CHEMISTS CO FOR COSMETICS AND MEDICAL INDUSTR,Abhaa cosmetic manufacture   ACM
2017-0140124-054244,كومبليت كير بلس غسول للفم ,complete care plus mouth wash,complete care plus,Saudi Arabia,300,Milliliter (ml),UNICARE FOR COSMETICS & Antiseptics ,unicare for cosmetics & antisepticsa
2017-0140124-054663,أورادين  غسول للفم,ORADINE mouth wash,ORADINE ,Saudi Arabia,300,Milliliter (ml),ARAB CHEMISTS CO FOR COSMETICS AND MEDICAL INDUSTR,Abhaa cosmetic manufacture   ACM
2017-0140124Code5-055076,برو تي جل معطر للفم ,PRO TEE MOUTH REFRESHING GEL,PRO TEE MOUTH REFRESHING GEL,Saudi Arabia,20,Gram (g),ARAB CHEMISTS CO FOR COSMETICS AND MEDICAL INDUSTR,Abhaa cosmetic manufacture   ACM
2017-0140124-055635,الكا غسول للعناية بالفم,ALKA mouth wash,ALKA mouth wash,Saudi Arabia,300,Milliliter (ml),ARAB CHEMISTS CO FOR COSMETICS AND MEDICAL INDUSTR,Abhaa cosmetic manufacture   ACM
2017-0140124Code5-056167,كليدنت جل معطر للفم,CLEDENT mouth refreshing gel,CLEDENT mouth refreshing gel,Saudi Arabia,30,Gram (g),ARAB CHEMISTS CO FOR COSMETICS AND MEDICAL INDUSTR,Abhaa cosmetic manufacture   ACM
2017-0140124Code4-056462,"ريباس مينتوس, معطر للفم, بالعسل والعكبر","RIBAS MINTOS, BREATH SPRAY, HONEY & PROPOLIS",RIBAS MINTOS,Saudi Arabia,20,Milliliter (ml),KAI FACTORY FOR CHEMICALS AND COSMETICS,KAI for chemicals and cosmetics
2017-0140124-056878,سيترولين غسول الفم بنكهة النعناع,Citrolen Mouthwash mint flavour,Citrolen ,Saudi Arabia,300,Milliliter (ml),Health and Beauty for cosmetic products,Health and Beauty Factorty for cosmetic Products
2017-014015401541-056903,ماندي زيت الخروع بنكهة الموز,mandy Castor Oil With Banana Flavor,Castor Oil Banana Flavor - زيت الخروع بنكهة الموز,Kingdom of Saudi Arabia,60,Milliliter (ml),Mohammed Salim Alkahwaji factory for Cosmetics,MOHAMMAD SALIM ALKAHWAJI FACTORY FORCOSMETICS &SHA
2017-014015401541-056911,ماندي زيت الخروع بنكهة الفواكه,mandy Castor Oil With Fruity Flavor,Castor Oil Fruity Flavor- زيت الخروع بنكهة الفواكه,Kingdom of Saudi Arabia,60,Milliliter (ml),Mohammed Salim Alkahwaji factory for Cosmetics,MOHAMMAD SALIM ALKAHWAJI FACTORY FORCOSMETICS &SHA
2017-0140124-057748,بي-فريش بلس غسول للفم,B-fresh Plus mouth wash ,B-Fresh Plus,Saudi Arabia,240,Milliliter (ml),UNICARE FOR COSMETICS & Antiseptics ,unicare for cosmetics & antisepticsa
2017-0140124-057788,استوما غسول للفم,STOMA mouth wash,STOMA mouth wash,Saudi Arabia,300,Milliliter (ml),ARAB CHEMISTS CO FOR COSMETICS AND MEDICAL INDUSTR,Abhaa cosmetic manufacture   ACM
2017-0140124Code5-057849,ليبولا جل للعناية بالفم,Lipola gel for oral care,Lipola Gel,Saudi Arabia,30,Milliliter (ml),UNICARE FOR COSMETICS & Antiseptics ,unicare for cosmetics & antisepticsa
2017-0140124Code4-058415,"ريباس مينتوس, معطر للتنفس, بالفواكة","RIBAS MINTOS, BREATH SPRAY, FRUIT",RIBAS MINTOS,Saudi Arabia,20,Milliliter (ml),KAI FACTORY FOR CHEMICALS AND COSMETICS,KAI for chemicals and cosmetics
2017-0140114-059990,اورو فريش كير - معجون تبيض الاسنان,ORO Fresh Care -whitening toothpaste,ORO Fresh Care ,Saudi Arabia,100,Gram (g),Sehr Alreef cosmetics factory,Alasriyah Academic Schools
2017-0140124Code5-059995,ماندي زيت الخروع بنكهة الفراولة,mandy Castor oil With Strawberry Flavor, mandy,Kingdom of Saudi Arabia,60,Milliliter (ml),Mohammed Salim Alkahwaji factory for Cosmetics,MOHAMMAD SALIM ALKAHWAJI FACTORY FORCOSMETICS &SHA
2017-0140124-060332,أوراهيكس غسول للفم,ORAHIX mouth wash,ORAHIX mouth wash,Saudi Arabia,300,Milliliter (ml),ARAB CHEMISTS CO FOR COSMETICS AND MEDICAL INDUSTR,Abhaa cosmetic manufacture   ACM
2017-0140124-060679,مينتورال غسول للفم,MINTORAL mouth wash,MINTORAL ,Saudi Arabia,300,Milliliter (ml),ARAB CHEMISTS CO FOR COSMETICS AND MEDICAL INDUSTR,Abhaa cosmetic manufacture   ACM
2017-0140124-061402,ريكليس غسول للفم,REKLESS mouth wash,REKLESS ,Saudi Arabia,300,Milliliter (ml),ARAB CHEMISTS CO FOR COSMETICS AND MEDICAL INDUSTR,Abhaa cosmetic manufacture   ACM
2017-0140124-061486,أورو فرش كير - بخاخ منعش للفم بالفراولة  ,Oro FreshCare- Mouth FreshenerStrawberry ,Oro FreshCare,Saudi Arabia,300,Milliliter (ml),Sehr Alreef cosmetics factory,Alasriyah Academic Schools
2017-0140124Code4-061568,"ريباس مينتوس, معطر للفم, بالليمون","RIBAS MINTOS, BREATH SPRY, LEMON",RIBAS MINTOS,Saudi Arabia,20,Milliliter (ml),KAI FACTORY FOR CHEMICALS AND COSMETICS,KAI for chemicals and cosmetics
2017-0140124-064227,اورا بروف غسول للفم,ORA PROF mouth wash,ORA PROF mouth wash,Saudi Arabia,300,Milliliter (ml),ARAB CHEMISTS CO FOR COSMETICS AND MEDICAL INDUSTR,Abhaa cosmetic manufacture   ACM
2019-0140114-154476,دابر الأعشاب معجون أسنان جل-بالليمون و النعناع جل,Dabur Herb'l Green Gel toothpaste-Mint & Lemon Gel,Dabur Herb'l,United Arab Emirates,150,Gram (g),Naturelle LLc,ARAB TRADING -TAMER GROUP
2019-0140124-154535,مونى موث ووش,Moony Mouth Wash,MOONY,Egypt,30,Milliliter (ml),HI CARE PHARMACEUTICALS & COSMETICS,gulfpioneer corp
2019-0140124-154535,مونى موث ووش,Moony Mouth Wash,MOONY,Egypt,60,Milliliter (ml),HI CARE PHARMACEUTICALS & COSMETICS,gulfpioneer corp
2019-0140124-154535,مونى موث ووش,Moony Mouth Wash,MOONY,Egypt,120,Milliliter (ml),HI CARE PHARMACEUTICALS & COSMETICS,gulfpioneer corp
2019-0140124-154535,مونى موث ووش,Moony Mouth Wash,MOONY,Egypt,150,Milliliter (ml),HI CARE PHARMACEUTICALS & COSMETICS,gulfpioneer corp
2019-0140124-154535,مونى موث ووش,Moony Mouth Wash,MOONY,Egypt,200,Milliliter (ml),HI CARE PHARMACEUTICALS & COSMETICS,gulfpioneer corp
2019-0140124-154535,مونى موث ووش,Moony Mouth Wash,MOONY,Egypt,240,Milliliter (ml),HI CARE PHARMACEUTICALS & COSMETICS,gulfpioneer corp
2016-0140114-034415,هيمالايا بوتانيك معجون أسنان مبيض لعناية كاملة  ال,Himalaya Botanique CC Toothpaste Simplycinnamon,himalaya Botanique,India,150,Milliliter (ml),The Himalaya Drug Company,Sara Group Holding
2016-0140114-034482,بارودونتكس معجون اسنان نظافة فائقة,Parodontax toothpaste Ultra Clean,Parodontax,Slovakia,75,Milliliter (ml),De Miclen s.r.o.,Ahmad Mohammad Abdul Wahab Naghi & Sons. Alnaghi
2018-0140124-102761,غسول الفم كولجيت بلاكس عناية متكاملة,Colgate Mouthwash Plax Complete Care,Colgate,Thailand,500,Milliliter (ml),COLGATE-PALMOLIVE (THAILAND) LIMITED,General Trading Company
2017-014015401541-061165,بومب بلسم شفاة ,bomb Lipalicious Lip Balm ,bomb,United Kingdom,9,Gram (g),Get Fresh Cosmetics Ltd trading as Bomb Cosmetics ,Almaa Almoalaj EST.
2017-014015401541-061166,بومب بلسم شفاة الفراولة دكيري,bomb  Strawberry Daiquiri Lip Balm  ,bomb,United Kingdom,9,Milliliter (ml),Get Fresh Cosmetics Ltd trading as Bomb Cosmetics ,Almaa Almoalaj EST.
2018-014015401541-102811,كالم بريز كامى غسول فم,calm breeze cammi mouth wash,sana pharma,Saudi Arabia,300,Milliliter (ml),sana pharma factory,Arad al hakim Corporation
2017-0140114-083795,طقم عناية بالاسنان شركة فندق الأنصار,HOTELS ALANSAR COMPANY DENTAL KIT ,HOTELS ALANSAR COMPANY,China,5,Gram (g),"YANGZHOU ECOWAY HOTEL SUPPLY CO.,LTD","Tazia Trading, Est."
2017-0140114-083860,معجون أسنان كولجيت ناتشورال اكستراكتس بياض ناصع,Colgate Toothpaste Natural Extracts Radiant White ,Colgate,China,75,Milliliter (ml),Colgate Palmolive (China) Company Limited,General Trading Company
2017-0140114-083889, معجون أسنان روكس برو تقويم الأسنان,ROCS PRO Brackets & Ortho Toothpaste,ROCS,Russia,135,Gram (g),DRC Global Ltd,Branch of Abdul Aziz Mesfer Al Asmary for Trading
2019-0140124-136605,كيمفور سى اتش اكس,Kemphor CHX,Kemphor,Spain,500,Milliliter (ml),Laboratorios Verkos S.A.,sayhan company united for distribution locally and
2019-0140124-136608,كيمفور فراولة,Kemphor Strawberry,Kemphor,Spain,500,Milliliter (ml),Laboratorios Verkos S.A.,sayhan company united for distribution locally and
2019-0140124-136610,كيمفور منعش,Kemphor Fresh,Kemphor,Spain,500,Milliliter (ml),Laboratorios Verkos S.A.,sayhan company united for distribution locally and
2019-0140114-136645,معجون اسنان بيبسودنت محارب التسوس + فرشاة اسنان,Pepsodent toothpaste germicheck+magnets+toothbrush,Pepsodent,India,150,Gram (g),Unilever India exports ltd. ,Baray Aljamal Establishment
2019-0140124-136663,كيمفور للثة,Kemphor gums,Kemphor,Spain,500,Milliliter (ml),Laboratorios Verkos S.A.,sayhan company united for distribution locally and
2019-0140114-136678,بانات وايتينينج توث بيست,Banat whitening toothpaste,Banat,Bulgaria,25,Milliliter (ml),STS HOLDİNG GROUP LTD.,AL-DAWAA Medical Services Co.Ltd
2019-014015401541-136697,جي-٣٢ مينت جيل للعنايه بالفم,G-32 Mint Gel for oral care,G-32 Mint Gel,United States,20,Gram (g),Ambix Laboratories,LIFE GATE MEDICAL EST.
2019-0140124-136731,أورا كير غسول للفم,Ora Care mouthwash,Ora Care,Kingdom of Saudi Arabia,300,Milliliter (ml),hotel suppliers factory,aljazira
2016-0140124Code4-034858,فريش توك بخاخ فم,Fresh Talk Mouth Spray,FreshTalk,United Kingdom,20,Milliliter (ml),Cheshire Fillers LTD,"BAABDULRAHIM TRADING CO., LTD"
2016-02-002720,ماكياج للشفاه,LauraMercier Cremesmooth Lip Colour - Brigitte,LauraMercier,Italy,4,Gram (g),Gurwitch,Nibras Al Arabia Company Limited
2016-02-002720,ماكياج للشفاه,LauraMercier Cremesmooth Lip Colour - 60's Pink,LauraMercier,Italy,4,Gram (g),Gurwitch,Nibras Al Arabia Company Limited
2016-02-002720,ماكياج للشفاه,LauraMercier Cremesmooth Lip Colour - Palm Beach,LauraMercier,Italy,4,Gram (g),Gurwitch,Nibras Al Arabia Company Limited
2016-02-002720,ماكياج للشفاه,LauraMercier Cremesmooth Lip Colour - Royal Orchid,LauraMercier,Italy,4,Gram (g),Gurwitch,Nibras Al Arabia Company Limited
2016-02-002720,ماكياج للشفاه,LauraMercier Cremesmooth Lip Colour - Girly,LauraMercier,Italy,4,Gram (g),Gurwitch,Nibras Al Arabia Company Limited
2016-02-002720,ماكياج للشفاه,LauraMe Cremesmooth Lip Colour - Strawberry Sorbet,LauraMercier,Italy,4,Gram (g),Gurwitch,Nibras Al Arabia Company Limited
2016-02-002720,ماكياج للشفاه,LauraMercier Cremesmooth Lip Colour - Pink Pout,LauraMercier,Italy,4,Gram (g),Gurwitch,Nibras Al Arabia Company Limited
2017-014015401541-061271,مرطب للشفاه بالنعناع ,COOL&COOL Lip Balm Cool Mint,COOL&COOL,Germany,4,Gram (g),ABC International Limited,Jaaz Trading Est.
2017-014015401541-061337,مرطب للشفاه بالليمون ,COOL&COOL Lip Balm LEMON ,COOL&COOL,Germany,4,Gram (g),ABC International Limited,Jaaz Trading Est.
2018-0140114-102836,ايفا سموكرز بودرة تنظيف الاسنان بالمسواك,Eva Smokers Tooth Powder with Meswak,Eva Smokers ,Egypt,40,Gram (g),Eva Cosmetics Corporation,Sara Group Holding
2018-0140114-102906,واي 588 يوكو هيربل توثبيست 100جرام,Y588 Yoko Herbal Toothpaste 100g,YOKO,Thailand,100,Gram (g),"SIAM YOKO CO., LTD.",almusbah trading group
2017-014015401541-065076,سيترولين جل الفم ,Citrolen Oral Gel,Citrolen,Saudi Arabia,20,Milliliter (ml),Health and Beauty for cosmetic products,Health and Beauty Factorty for cosmetic Products
2017-014015401541-068948,دنتا هيل جل معطر للفم ,DENTAHEEL oral refreshing gel,DENTAHEEL oral refreshing gel,Saudi Arabia,30,Gram (g),ARAB CHEMISTS CO FOR COSMETICS AND MEDICAL INDUSTR,Abhaa cosmetic manufacture   ACM
2017-0140124-071901,كير دينت غسول الفم,Care Dent mouthwash,Care Dent,Saudi Arabia,250,Milliliter (ml),Health and Beauty for cosmetic products,Health and Beauty Factorty for cosmetic Products
2017-0140124-072448,بيرسيم غسول الفم,Purism mouthwash,Purism,Saudi Arabia,300,Milliliter (ml),Health and Beauty for cosmetic products,Health and Beauty Factorty for cosmetic Products
2017-0140124Code4-072900,فليكسو أورال لعناية الفم,Flixo Oral for mouth care,Flixo Oral,Saudi Arabia,60,Milliliter (ml),Health and Beauty for cosmetic products,Health and Beauty Factorty for cosmetic Products
2017-0140114-073597,معجون أسنان كولجيت-نكهة عادية رائعة,Colgate Toothpaste Great Regular Flavour,Colgate,Saudi Arabia,175,Milliliter (ml),Colgate Palmolive Arabia LTD,Colgate Palmolive Arabia
2017-0140114-073597,معجون أسنان كولجيت-نكهة عادية رائعة,Colgate Toothpaste Great Regular Flavour,Colgate,Saudi Arabia,120,Milliliter (ml),Colgate Palmolive Arabia LTD,Colgate Palmolive Arabia
2017-0140114-073597,معجون أسنان كولجيت-نكهة عادية رائعة,Colgate Toothpaste Great Regular Flavour,Colgate,Saudi Arabia,50,Milliliter (ml),Colgate Palmolive Arabia LTD,Colgate Palmolive Arabia
2017-0140124-074307,بيروكسيد غسول للعناية بالفم,PEROXYD mouth wash,PEROXYD mouth wash,Saudi Arabia,250,Milliliter (ml),ARAB CHEMISTS CO FOR COSMETICS AND MEDICAL INDUSTR,Abhaa cosmetic manufacture   ACM
2017-0140124-074309,كلوفا كير غسول للفم,CLOVA CARE mouth wash,CLOVA CARE mouth wash,Saudi Arabia,300,Milliliter (ml),ARAB CHEMISTS CO FOR COSMETICS AND MEDICAL INDUSTR,Abhaa cosmetic manufacture   ACM
2018-0140114-120222,ناترودنت رويال جيلي توثباست,HOLLINZ natrodent royal jelly toothpaste ,HOLLINZ,Italy,100,Milliliter (ml),Optima Consumer Health Ltd,AL-DAWAA Medical Services Co.Ltd
2018-0140114-120313,بيو لايف دي معجون اسنان لمستخدمي تركيبات و تقويم الاسنان,BIO LIFE D EXCLUSIVE TOOTHPASTE FOR PEOPLE WEARING BRACES,BIO LIFE D,Poland,75,Milliliter (ml),BIOCEUTICS.POL SP. Z O. O.,Ali Hamud for treading
2018-0140114-120315,بيو لايف دي معجون اسنان لمستخدمي تركيبات الاسنان و بعد نزع تقويم الاسنان,BIO LIFE D EXCLUSIVE TOOTHPASTE FOR PEOPLE WEARING BRACES,BIO LIFE D,Poland,75,Milliliter (ml),BIOCEUTICS.POL SP. Z O. O.,Ali Hamud for treading
2019-014015401541-154633,الماس الأعيان,ALMAS AL AYAAN,DEHNEE PERFUME FACTORY,United Arab Emirates,100,Milliliter (ml), DEHNEE PERFUME FACTORY,NAJMAT AL-EMIRAT TRADING EST.
2019-014015401541-154634,أمير العرب,AMEER AL ARAB,DEHNEE PERFUME FACTORY,United Arab Emirates,100,Milliliter (ml), DEHNEE PERFUME FACTORY,NAJMAT AL-EMIRAT TRADING EST.
2019-0140114-154652,كلوس اب معجون اسنان  دايموند اتراكشن,close up toothpaste Diamond Attraction power white,CLOSE UP,Egypt,75,Milliliter (ml),Unilever Mashreq for Personal Care,Binzager Unilever Distribution Company Limited
2019-0140124-154949,أوراسنت_غسول للفم _250 مل, Orascent_ Mouthwash_ 250 ML ,Orascent mouthwash,Italy,250,Milliliter (ml),ANEVA ITALIA S.R.L FOR COSMETIC,pure united corporate for trading
2017-0140124-080712,أورو  فرش كير _ مضمضة للفم,Oro-FreshCare -  Mouthwash,Oro-FreshCare,Saudi Arabia,300,Milliliter (ml),Sehr Alreef cosmetics factory,Alasriyah Academic Schools
2017-0140124-081627,هيكساسبت غسول للفم,HEXASEPT mouth wash,HEXASEPT mouth wash,Saudi Arabia,300,Milliliter (ml),ARAB CHEMISTS CO FOR COSMETICS AND MEDICAL INDUSTR,Abhaa cosmetic manufacture   ACM
2017-0140114-081754,اورو فريش كير -معجون اسنان ,ORO fresh Care-Anti blrrding toothpaste,ORO fresh Care,Saudi Arabia,75,Gram (g),Sehr Alreef cosmetics factory,Alasriyah Academic Schools
2017-0140114-083998,معجون أسنان روكس لتبيض الاسنان بالفرشاة الكهربائية,ROCS Pro Electro & Whitening Toothpaste,ROCS,Russia,135,Gram (g),DRC Global Ltd,Branch of Abdul Aziz Mesfer Al Asmary for Trading
2017-0140114-084004,أورال-بي تنظيف لطيف لترميم اللثة ومينا الأسنان,Oral-B Gum & Enamel Repair Gentle Clean Toothpaste,ORAL B,Germany,75,Milliliter (ml),Procter & Gamble Manufacturing GmbH,Ahmad Mohammad Abdul Wahab Naghi & Sons. Alnaghi
2017-0140114-084035,كين- معجون الأسنان سينسيكين ,Kin-Sensikin Toothpaste,KIN ,Spain,75,Milliliter (ml),Laboratorios Kin S.A,Zimmo Trading Company Limited
2017-0140114-084035,كين- معجون الأسنان سينسيكين ,Kin-Sensikin Toothpaste,KIN ,Spain,7,Gram (g),Laboratorios Kin S.A,Zimmo Trading Company Limited
2017-0140114-084045,ديل اكسيجين معجون اسنان ,DEL XYGENE TOOTHP ASTE,DEL XYGENE ,China,17,Gram (g),"YANGZHOU ECOWAY HOTEL SUPPLY CO.,LTD",wadiah awad alkarim mohamed alsayd EST
2017-0140114-084079,أورال-بي انتعاش أكثر لترميم اللثة ومينا الأسنان,Oral-B Gum & Enamel Repair Extra Fresh Toothpaste,ORAL B,Germany,75,Milliliter (ml),Procter & Gamble Manufacturing GmbH,Ahmad Mohammad Abdul Wahab Naghi & Sons. Alnaghi
