ProductNumber,ProductArName,ProductEnName,BrandName,CounrtyEn,PackageVolume,UnitEn,manufactureenglishname,ListedNameEn
2016-0140124-037182,هيمالايا أعشاب غسول الفم لعناية كاملة ,Himalaya Herbals Complete Care Mouth Wash,Himalaya Herbals,India,215,Milliliter (ml),The Himalaya Drug Company,Sara Group Holding
2016-0140114-037221,هايحين جل أسنان للصغار الموز,HiGeen Kids Tooth Gel Banana,HiGeen,Jordan,60,Gram (g),Household and Toiletries Manufacturing Co.  ,ِAbdulrehman Algosaibi GTC
2015-0140114-002209,جيجا فريش معجون اسنان للأطفال,Gigafresh Kids Toothpaste,Gigafresh,Turkey,65,Gram (g),SPC KOZETIK YAZILIM SAN. VE TIC. LTD. STI,Areej Alandalus for trading
2015-0140114-002237,دابر الأعشاب معجون أسنان جل الألوة فيرا  ,Dabur Herb'l Aloe Vera Gel Toothpaste,Dabur Herb'l Aloe Vera Gel Toothpaste,United Arab Emirates,150,Gram (g),Naturelle LLC ,Khalifa Abdul Rahman Al Gosaibi Cold Stores
2015-0140124-002347,انليفن فريشمنت موث واش,Enliven freshmint mouth wash helps to fight the b ,Enliven,United Kingdom,500,Milliliter (ml),DCS manufacturing ltd,murad trading Est
2015-03-000001,أنكورمعجون أسنان التسوس والمسواك (عرض٢٠% ٣ عبوة) ـ,Anchor Toothpaste ACP MISWAK (20% OFF TRI PACK),Anchor,India,120,Gram (g),Anchor Health & Beauty Care Pvt. Ltd.,Quraish Trading and industrial Company ltd
2015-03-000001,أنكورمعجون أسنان التسوس والمسواك (عرض٢٠% ٣ عبوة) ـ,Anchor Toothpaste ACP MISWAK (20% OFF TRI PACK),Anchor,India,240,Gram (g),Anchor Health & Beauty Care Pvt. Ltd.,Quraish Trading and industrial Company ltd
2015-0140124-002433,مضمضة جيجافريش بلس,Gigafresh Plus Mouthwash,Gigafresh,Turkey,250,Milliliter (ml),SPC KOZETIK YAZILIM SAN. VE TIC. LTD. STI,Areej Alandalus for trading
2015-0140114-002434,معجون جيجا فريش للتقويم,Gigafresh Orthodontic Toothpaste,Gigafresh,Turkey,100,Gram (g),SPC KOZETIK YAZILIM SAN. VE TIC. LTD. STI,Areej Alandalus for trading
2015-02-000029,أنكور معجون أسنان منعش  ( 2 بكت بسعر 10 ريال) ـ,Anchor Toothpaste TANGY (SAR 10 TWIN PACK 125ML),Anchor,India,250,Milliliter (ml),Anchor Health & Beauty Care Pvt. Ltd.,Quraish Trading and industrial Company ltd
2015-02-000029,أنكور معجون أسنان بالمنثول  ( 2 بكت بسعر 10 ريال) ,Anchor Toothpaste MENTHOL (SAR 10 TWIN PACK 125ML),Anchor,India,250,Milliliter (ml),Anchor Health & Beauty Care Pvt. Ltd.,Quraish Trading and industrial Company ltd
2015-02-000029,أنكور معجون أسنان  ليمون  ( 2 بكت بسعر 10 ريال) ـ,Anchor Toothpaste LEMON(SAR 10 TWIN PACK 125ML),Anchor,India,250,Milliliter (ml),Anchor Health & Beauty Care Pvt. Ltd.,Quraish Trading and industrial Company ltd
2015-014015401541-002615,السي ميد كومبليت بلس وايتينينج,El-cemed complete plus whitening,El-cemed,Germany,75,Milliliter (ml),DENTAL KOSMETIK GMBH&COKG,color of life medical Est
2016-0140114-037351,سانينو فريش لونق لاستنق فريش بريث 50مل ,Sanino fresh long lasting fresh breath 50ml,Sanino,Turkey,50,Milliliter (ml),Evyap Sabun Yag GliserinSan ve Ticaret A.S,AL-DAWAA Medical Services Co.Ltd
2016-0140114-037352,سانينو فريش لونق لاستننق فريش بريث 100مل,Sanino fresh long lasting fresh breath 100ml,Sanino,Turkey,100,Milliliter (ml),Evyap Sabun Yag GliserinSan ve Ticaret A.S,AL-DAWAA Medical Services Co.Ltd
2016-0140114-037364,سانينو توتال كير كومبليت ماوث كير 50مل ,Sanino total care complete mouth care 50ml ,Sanino,Turkey,50,Milliliter (ml),Evyap Sabun Yag GliserinSan ve Ticaret A.S,AL-DAWAA Medical Services Co.Ltd
2016-0140114-037365,سانينو انتي كافتي بروتيكشن اقنيست كافيتي 100مل ,Sanino antiCavity protection against cavities100ml,Sanino,Turkey,100,Milliliter (ml),Evyap Sabun Yag GliserinSan ve Ticaret A.S,AL-DAWAA Medical Services Co.Ltd
2017-0140114-063455,سبلات بروفشنال سينسيتيف معجون اسنان حيوى نشط,SPLAT PROFESSIONAL SENSITIVE BIO-ACTIVE TOOTHPASTE,SPLAT PROFESSIONAL,Russia,100,Milliliter (ml),ORGANIC PHARMACEUTICALS,Arma Trading Est
2017-0140114-063456,سبلات معجون اسنان طبيعى فراوله بريه وكرز,SPLAT NATURAL TOOTHPASTE WILD STRAWBERRY=CHERRY,SPLAT,Russia,50,Milliliter (ml),ORGANIC PHARMACEUTICALS,Arma Trading Est
2017-0140114-085880,كين- جل سينسيكين بالنعناع  ,Kin- Sensikin Gel ,kin ,Spain,15,Gram (g),Laboratorios Kin S.A,Zimmo Trading Company Limited
2017-0140114-085880,كين- جل سينسيكين بالنعناع  ,Kin- Sensikin Gel ,kin ,Spain,3,Gram (g),Laboratorios Kin S.A,Zimmo Trading Company Limited
2017-0140114-085893,بيوميد سوبروايت كومبليت كير ناتشورال توثبيست,Biomed Superwhite Complete Care Natural Toothpaste,Biomed ,Russia,100,Gram (g),ORGANIC PHARMACEUTICALS LLC,sayhan company united for distribution locally and
2019-0140124-141636,غسول فم  امكير,M care mouth wash,M care,Saudi Arabia,50,Milliliter (ml),Gulf Care Factory for Health Care & Cosmetics,Gulf Care Factory for Health Care & Cosmetics
2019-014015401541-150852,نوستريكيور جل للفم,Nostricure Oral Gel,NOSTRI,Saudi Arabia,30,Milliliter (ml),UNICARE FOR COSMETICS & Antiseptics ,unicare for cosmetics & antisepticsa
2018-0140114-122004,فرشة اسنان الفرسان, Alfursan toothpaste ,alfursan,China,6,Gram (g),"YANGZHOU KAILAI HOTEL AMENITIES CO.,LTD",Garden Plaza Hotel
2018-0140114-122004,فرشة اسنان الفرسان, Alfursan toothpaste ,alfursan,China,5,Gram (g),"YANGZHOU KAILAI HOTEL AMENITIES CO.,LTD",Garden Plaza Hotel
2018-0140114-122004,فرشة اسنان الفرسان, Alfursan toothpaste ,alfursan,China,10,Gram (g),"YANGZHOU KAILAI HOTEL AMENITIES CO.,LTD",Garden Plaza Hotel
2015-0140124-002693,السي ميد كرويتر غسول الفم,El-cemed krauter mouthwash,el-cemed,Germany,500,Milliliter (ml),DENTAL KOSMETIK GMBH&COKG,color of life medical Est
2015-0140114-002739,دابر المسواك - جل منعش,Dabur Miswak - Fresh Gel,Dabur,United Arab Emirates,90,Gram (g),Naturelle LLC ,Khalifa Abdul Rahman Al Gosaibi Cold Stores
2015-0140114-002789,"إيموفورم , للعناية باللثة أزرق","Emoform, GUM CARE BLUE",EMOFORM,Switzerland,85,Milliliter (ml),Dr.Wild & Co. AG,Middle East Drug Store
2015-0140114-002791,"إيموفورم -إف ,للأسنان الحساسه بالفلورايد","Emoform-F SENSITIVE, WITH FLORIDE",Emoform-F,Switzerland,50,Milliliter (ml),Dr.Wild & Co. AG,Middle East Drug Store
2015-0140114-002791,"إيموفورم -إف ,للأسنان الحساسه بالفلورايد","Emoform-F SENSITIVE, WITH FLORIDE",Emoform-F,Switzerland,85,Milliliter (ml),Dr.Wild & Co. AG,Middle East Drug Store
2015-0140114-002792,"ايموفلورجل ,فليوريد القصدير المركز بنسبة0.4  % ","EMOFLOUR GEL, STABILISED STANNOUS FLURIDE 0.4%",EMOFLOUR,Switzerland,75,Milliliter (ml),Dr.Wild & Co. AG,Middle East Drug Store
2015-014015401541-002813,ايموفورم-ف للأسنان الحساسه,EMOFORM-F SENSITIVE,EMOFORM-F,Switzerland,50,Milliliter (ml),Dr.Wild & Co. AG,Middle East Drug Store
2015-0140114-002837,مومنتوم طقم فرشاه الاسنان,momentum dental kit,Momentum,China,5,Gram (g),"Yangzhou Kailai Hotel Amenities Co.,Ltd","Tazia Trading, Est."
2015-0140124-002934,ميردول ماوث واش ,Meridol Mouth Wash,Meridol,Egypt,250,Milliliter (ml),Egyption Company For Cosmetic,Mohra Olaythah Mohssen Al-Refaay Establishment
2015-0140114-002983,جبجا فريش معجوناسنان للاستخدام اليومي,Gigafresh Daily Use Toothpaste,Gigafresh,Turkey,100,Gram (g),SPC KOZETIK YAZILIM SAN. VE TIC. LTD. STI,Areej Alandalus for trading
2015-0140114-003052,رايا جونيور نكهة العنب,Raiya grape flavour,Raiya,Malaysia,75,Gram (g),Fulian (M) SDN. BHD.,AL Nahhas Trading company
2015-0140114-003078,معجون جيجا فريش للثة الحساسة,Gigafresh Gum Toothpaste,Gigafresh,Turkey,75,Gram (g),SPC KOZETIK YAZILIM SAN. VE TIC. LTD. STI,Areej Alandalus for trading
2016-0140114-037416,سانينو وايتنق بريقهيتر سمايل 100مل ,Sanino whitening brighter smiles 100ml ,Sanino,Turkey,100,Milliliter (ml),Evyap Sabun Yag GliserinSan ve Ticaret A.S,AL-DAWAA Medical Services Co.Ltd
2016-0140114-037562,سانينو انتي كافتي بروتكشن اجنيست كافيتي 50مل ,Sanino antiCavity protection against cavities50ml,Sanino,Turkey,50,Milliliter (ml),Evyap Sabun Yag GliserinSan ve Ticaret A.S,AL-DAWAA Medical Services Co.Ltd
2018-0140114-104598,معجون أسنان كولجيت توتال ١٢ نكهة منعشة,Colgate Toothpaste Total 12 Fresh Stripe,Colgate,Poland,100,Milliliter (ml),COLGATE-PALMOLIVE MANUFACTURING (POLAND) SPÖLKAZ,General Trading Company
2018-0140114-104633,معجون أسنان كولجيت توتال ١٢ برو لنفس صحي,Colgate Toothpaste Total 12 Pro Breath Health,Colgate,Poland,75,Milliliter (ml),COLGATE-PALMOLIVE MANUFACTURING (POLAND) SPÖLKAZ,General Trading Company
2019-0140114-138834,معجون برش اب وايت بلاس,WHITE PUS BRUSH UP,BRUSH UP,United Arab Emirates,180,Gram (g),ANSAR HARFORD FZC,Matajer Al Ghithae Al Mufeed Est for Imports
2019-0140114-138867,"دوست سويتس, معجون اسنان 6 جرام","Duset Suites, Toothpaste 6gm",Duset Suites,China,6,Gram (g),"iHotel Guest Amenities Co., LTD",Al soura Al jadeda office for commercial services
2019-0140114-138871,معجون برش اب الازرق,BRUSH U ICE BLUE MINTY GEL ,BRUSH UP,United Arab Emirates,180,Gram (g),ANSAR HARFORD FZC,TAMAIZ ASIA TRADING AND MARKETING ESTABLISHMENT
2019-0140114-138876,فرشاة و معجون اسنان للفنادق,Dental kit for hotels,ALMASS,China,6,Milliliter (ml),"ZTT ADP Suplply chine management Co.,Ltd",WEST DIAMOND
2019-0140124Code5-138897, أوراستين,Orastrin gel,Orastrin,Kingdom of Saudi Arabia,20,Milliliter (ml),hotel suppliers factory,aljazira
2019-014015401541-138949,اي ديرما ستيك ليفريس ,ِA derma stick levres ,ِِA-derma,France,4,Gram (g),Pierre Fabre,Annahdah medical company
2019-0140134Code6-156367,كوكو بلاك - مسحوق تبييض الأسنان,Coco Black - Teeth Whitening Powder,Mr.Scrubber,Ukraine,20,Gram (g), Physical Person-Entrepreneur Kashuba Serhii Anato,gulfcare medical trading company
2017-0140114-085948,لوازم العناية بالأسنان,CORAL DENTAL KIT,CORAL,China,10,Gram (g),Yangzhou New Lotus,Rolaco Hospitality Supplies
2015-0140124-003164,دابر إلمسواك النعناع المنعش,Dabur Miswak - Mint Fresh,Dabur Miswak,United Arab Emirates,250,Milliliter (ml),Naturelle LLC ,Khalifa Abdul Rahman Al Gosaibi Cold Stores
2015-0140114-003165,اوه وايت دايوايت + وايتنيق توثبيست,oh!white daywhite+ whitening toothpaste,OHwhite,Spain,75,Milliliter (ml),VAYRIM DERMOLIFE COSMETIC S.L.,AL-DAWAA Medical Services Co.Ltd
2015-0140124-003167,اوه ! وايت هوم كير كولكس وايت+ وايتينينج ماوث وش,oh! white home care coluxwhite+ whitening mouth wa,oh ! white home care,Spain,500,Milliliter (ml),VAYRIM DERMOLIFE COSMETIC S.L.,AL-DAWAA Medical Services Co.Ltd
2015-0140114-003215,فلورودين ألترا أكتيف تووث بيست,flourodine ultra active tooth paste,fluorodine,United Kingdom,100,Milliliter (ml),Multibrands International Ltd,Innova HC
2015-0140114-003216,فلورودين أوكسيجين وايت تووث بيست,fluorodine oxygen white tooth paste,fluorodine,United Kingdom,100,Milliliter (ml),Multibrands International Ltd,Innova HC
2015-0140124-003221,فلورودين أكتيف فريش ماوث ووش,fluorodine active fresh mouth wash ,fluorodine,United Kingdom,500,Milliliter (ml),Multibrands International Ltd,Innova HC
2015-0140124-003234,فلورودين ألترا أكتيف ماوث ووش,fiuorodine ultra active mouth wash,fluorodine,United Kingdom,500,Milliliter (ml),Multibrands International Ltd,Innova HC
2015-0140134Code6-003369,سيلكا معجون اسنان بريليانت وايت ,Silca toothpaste Brilliant White,silca,Germany,100,Milliliter (ml),DENTAL KOSMETIK GMBH&COKG,color of life medical Est
2015-0140124-003398,ماي كير ماوث ووش ميكس ريد فروت ريبير,mycare mouthwash mix red fruit repair,mycare,Turkey,250,Milliliter (ml),SPC Kozmetik ,mohammad wajeeh AL qubbay pharmacy
2015-02-000040,رايا جونيور معجون أسنان للاطفال نكهة الفواكه,Raiya Junior toothpaste  fruity flavour,Raiya,Malaysia,75,Gram (g),Fulian (M) SDN. BHD.,AL Nahhas Trading company
2015-02-000040,رايا جونيور معجون أسنان للاطفال نكهة المانجو,Raiya Junior toothpaste mango flavour,Raiya,Malaysia,75,Gram (g),Fulian (M) SDN. BHD.,AL Nahhas Trading company
2015-02-000040,رايا جونيور  معجون اسنان  للاطفال نكهة الفراولة,Raiya Junior toothpaste strawberry flavour,Raiya,Malaysia,75,Gram (g),Fulian (M) SDN. BHD.,AL Nahhas Trading company
2015-02-000040,رايا جونيور معجون أسنان للاطفال نكهة البرتقال ,Raiya Junior toothpaste orange flavour,Raiya,Malaysia,75,Gram (g),Fulian (M) SDN. BHD.,AL Nahhas Trading company
2015-02-000040,رايا جونيور معجون أسنان للأطفال بنكهة العنب,Raiya Junior toothpaste grape flavour,Raiya,Malaysia,75,Gram (g),Fulian (M) SDN. BHD.,AL Nahhas Trading company
2015-02-000040,رايا جونيور معجون أسنان للأطفال نكهة التفاح,Raiya Junior toothpaste apple flavour,Raiya,Malaysia,75,Gram (g),Fulian (M) SDN. BHD.,AL Nahhas Trading company
2015-0140124-003466,اورتيجا رينزو ماوث رفريشنق واش ,Oratega Rinzo Mouth Refreshment wash,Oratega,Egypt,250,Milliliter (ml),Egyptian Company For Cosmetic ,Joud Advanced For Trading Establishment
2015-0140114-003477,جيجا فريش معجون اسنان للتبيض,Gigafresh Whitening Toothpaste,Gigafresh,Turkey,100,Gram (g),SPC KOZETIK YAZILIM SAN. VE TIC. LTD. STI,Areej Alandalus for trading
2015-0140114-003484,فلوريدين اوكسيجين وايت بيرفورمانس توث بيست,Fluoridine Oxygen White performance toothpaste,Fluorodine,United Kingdom,100,Milliliter (ml),Multibrands International Ltd,Innova HC
2015-0140124-003486,مضمضة جيجافريش فموية للتقويم,Gigafresh Orthodontic Mouthwash,Gigafresh,Turkey,250,Milliliter (ml),SPC KOZETIK YAZILIM SAN. VE TIC. LTD. STI,Areej Alandalus for trading
2015-04-000014,اوه! وايت هوم كير دنتال تيك+ ستارتاركيت,oh! white home care dentaltech+ starter kit,oh!white home care,Spain,5,Milliliter (ml),VAYRIM DERMOLIFE COSMETIC S.L.,AL-DAWAA Medical Services Co.Ltd
2015-04-000014,اوه! وايت سيلفر وايتيننج أكسيليراتور,oh!white silver whitening accelerator,oh! white,Spain,5,Milliliter (ml),VAYRIM DERMOLIFE COSMETIC S.L.,AL-DAWAA Medical Services Co.Ltd
2015-04-000014,أوه وايت دينتال كلينينج وايبس,oh!white dental cleaning wipes,oh!white,Spain,3,Wipes ,VAYRIM DERMOLIFE COSMETIC S.L.,AL-DAWAA Medical Services Co.Ltd
2015-014015401541-003519,ألودنت معجون الأسنان الحساسة,AloeDent Aloe Vera Sensitive Toothpaste,AloeDent,Italy,50,Milliliter (ml),Optima Consumer Health Ltd,AL-DAWAA Medical Services Co.Ltd
2015-014015401541-003519,ألودنت معجون الأسنان الحساسة,AloeDent Aloe Vera Sensitive Toothpaste,AloeDent,Italy,100,Milliliter (ml),Optima Consumer Health Ltd,AL-DAWAA Medical Services Co.Ltd
2016-0140134Code6-037674,اوه وايت مون وايت +فوم نايت ,oh!white moonwhite+ foam night,oh!white,Spain,100,Milliliter (ml),LABORATORIOS ENTEMA S.L.,AL-DAWAA Medical Services Co.Ltd
2016-0140114-037700,كرست 3D بياض ديلوكس انتعاش التبريد,Crest 3DWhite Deluxe Arctic Fresh Toothpaste,CREST,Germany,75,Milliliter (ml),Procter & Gamble Manufacturing GmbH,Ahmad Mohammad Abdul Wahab Naghi & Sons. Alnaghi
2016-0140114-037710,بوبيني معجون اسنان للأطفال بنكهة الفراولة,BOBINI KINDERZ AHNCREME,BOBINI,Germany,75,Milliliter (ml),Global Cosmed International GmbH,Sabeel Aldawa Mediway Co.
2018-0140114-122293,فرشاة أسنان مع معجون,ROYAL COLLECTION dental kit,ROYAL COLLECTION,China,6,Gram (g),Yangzhou Safepure Daily Chemical Cleaning Products,innovators.pioneers
2018-0140114-104847,سنسوداين معجون أسنان واقي المينا حماية يومية,Sensodyne Toothpaste Pronamel Daily Protection,Sensodyne,United Arab Emirates,75,Milliliter (ml),Gulf Center Cosmetics Manufacturing L.L.C.,Ahmad Mohammad Abdul Wahab Naghi & Sons. Alnaghi
2018-0140114-104853,سنسوداين معجون أسنان واقي المينا إنتعاش أكثر,Sensodyne Toothpaste Pronamel Extra Freshness,Sensodyne,United Arab Emirates,75,Milliliter (ml),Gulf Center Cosmetics Manufacturing L.L.C.,Ahmad Mohammad Abdul Wahab Naghi & Sons. Alnaghi
2019-0140124-153090,سيتروهيكس غسول للفم,CITROHEX Mouth Wash,سيتروهيكس,Saudi Arabia,300,Milliliter (ml),Sehr Alreef cosmetics factory,Alasriyah Academic Schools
2019-014015401541-155332,إزي فريش غسول الفم مع النعناع المثلج 500 مل		,Ez Fresh Mouth Wash with Ice Mint 500 ml		,Avalon Pharma,Saudi Arabia,500,Milliliter (ml),Middle East Pharmaceutical Industries Co. Ltd.,Middle East Pharmaceutical Industries Co. Ltd.
2019-0140114-158052,اورادنت جل التسنين,Oradent Teething Gel,Oradent ,Saudi Arabia,20,Gram (g),Gulf Care Factory for Health Care & Cosmetics,Gulf Care Factory for Health Care & Cosmetics
2019-0140114-139123,كلوس اب إنتعاش النعناع مع تركيبة غسول الفم المقاوم اابكتيريا,CLOSE UP MENTHOLFRESH WITH ANTI BACTERIAL MOUTHWASH,Unilever,Egypt,50,Milliliter (ml),Unilever Mashreq for Personal Care,Binzager Unilever Distribution Company Limited
2019-0140114-139123,كلوس اب إنتعاش النعناع مع تركيبة غسول الفم المقاوم اابكتيريا,CLOSE UP MENTHOLFRESH WITH ANTI BACTERIAL MOUTHWASH,Unilever,Egypt,120,Milliliter (ml),Unilever Mashreq for Personal Care,Binzager Unilever Distribution Company Limited
2019-0140114-139161,معجون برش اب بحلاصة المسواك,BRUSH UP GREEN MISWAK,BRUSH UP,United Arab Emirates,180,Gram (g),ANSAR HARFORD FZC,TAMAIZ ASIA TRADING AND MARKETING ESTABLISHMENT
2019-0140114-139245,كلوس اب أحمر حار مع تركيبة غسول الفم المقاوم اابكتيريا,CLOSE UP REDHOT WITH ANTI BACTERIAL MOUTHWASH,CLOSE UP,Egypt,50,Milliliter (ml),Unilever Mashreq for Personal Care,Binzager Unilever Distribution Company Limited
2019-0140114-139245,كلوس اب أحمر حار مع تركيبة غسول الفم المقاوم اابكتيريا,CLOSE UP REDHOT WITH ANTI BACTERIAL MOUTHWASH,CLOSE UP,Egypt,120,Milliliter (ml),Unilever Mashreq for Personal Care,Binzager Unilever Distribution Company Limited
2019-0140114-139247,سيجنال متكامل 8 مبيض ,SIGNAL Tooth Paste COMPLETE 8 WHITE,Signal,Egypt,100,Milliliter (ml),Unilever Mashreq for Personal Care,Binzager Unilever Distribution Company Limited
2019-0140114-139251,سيجنال متكامل 8 حماية اللثة,SIGNAL Tooth Paste COMPLETE 8 GUM PROTECTION,Signal,Egypt,100,Milliliter (ml),Unilever Mashreq for Personal Care,Binzager Unilever Distribution Company Limited
2015-0140124-003539,بيوميكس غسول منعش للفم,Bio Mix Refresh Mouth Wash,Biostar Tec,Egypt,250,Milliliter (ml),Egyptian Company For Cosmetic,Serenity Medical Foundation Pulse
2015-0140124-003543,فلورودين سينسيتيف أكتيف ماوث ووش,fluorodine sensitive active mouth wash,fluorodine,United Kingdom,500,Milliliter (ml),Multibrands International Ltd,Innova HC
2015-04-000015,أوه! وايت هوم كير دينتال تيك + ريفيل كيت,oh!white home care dentaltech+ refill kit,oh! white,Spain,5,Milliliter (ml),VAYRIM DERMOLIFE COSMETIC S.L.,AL-DAWAA Medical Services Co.Ltd
2015-04-000015,أوه! وايت سيلفر+ وايتينينج أكسليراتور ديسبنسور,oh! white silver+ whitening accelerator dispensor,oh! white,Spain,5,Milliliter (ml),VAYRIM DERMOLIFE COSMETIC S.L.,AL-DAWAA Medical Services Co.Ltd
2015-04-000015,أوه وايت دينتال كلينينج وايبس,oh!white dental cleaning wipes,oh!white,Spain,3,Wipes ,VAYRIM DERMOLIFE COSMETIC S.L.,AL-DAWAA Medical Services Co.Ltd
2015-014015401541-003573, دينتينوكس بلسم دهان ملطف للثة الاطفال,Dentinox Balm for baby's gums,Dentinox,United Kingdom,15,Gram (g),DDD Limited,Saudi Arabian Drug Store Company Ltd.
2015-0140114-003626,جيجا فريش معجون اسنان للأسنان الحساسة,Gigafresh Sensitive Toothpaste,Gigafresh,Turkey,100,Gram (g),SPC KOZETIK YAZILIM SAN. VE TIC. LTD. STI,Areej Alandalus for trading
2015-0140124-003627,جيجا فريش مضمضة فموية للاسنان الحساسة,Gigafresh Sensitive Teeth Mouthwash,Gigafresh,Turkey,250,Milliliter (ml),SPC KOZETIK YAZILIM SAN. VE TIC. LTD. STI,Areej Alandalus for trading
2015-0140124-003629,جيجا فريش مضمضة فموية لتبيض الاسنان,Gigafresh Ultra Whitening Mouthwash,Gigafresh,Turkey,250,Milliliter (ml),SPC KOZETIK YAZILIM SAN. VE TIC. LTD. STI,Areej Alandalus for trading
2015-0140114-003631,دابر السواك معجون العشبي بخلاصة  جل منعش,Dabur Miswak Herbal Toothpaste - Fresh Gel,Dabur ,United Arab Emirates,90,Gram (g),Naturelle LLC ,Khalifa Abdul Rahman Al Gosaibi Cold Stores
2015-0140114-003675,السي ميد فورتي فيتال توتال كير ,EL-cemed 40 Vital Total Care,el-cemed,Germany,100,Milliliter (ml),DENTAL KOSMETIK GMBH&COKG,color of life medical Est
2015-0140114-003676,دابر احمر معجون أسنان,Dabur Red Toothpaste,Dabur,United Arab Emirates,100,Gram (g),Naturelle LLC ,Khalifa Abdul Rahman Al Gosaibi Cold Stores
2015-0140114-003702,درنف طقم فرشاه اسنان,Drnef Dental Kit,Drnef,China,5,Gram (g),"Yangzhou Kailai Hotel Amenities Co.,Ltd","Tazia Trading, Est."
2015-0140124-003739,ماي كير ماوث ووش اكسترا فريش,mycare mouthwash extra fresh,mycare,Turkey,250,Milliliter (ml),SPC Kozmetik ,mohammad wajeeh AL qubbay pharmacy
2015-0140114-003809,زيفا مناديل للأسنان 12 منديل,ZIVA TOOTH WIPES  12 WIPE,ZIVA,United Arab Emirates,75,Gram (g),ZIVA WETWIPES FZCO,Global Entrepreneurship Development co contracting
2015-0140114-003812,السي ميد معجون اسنان كول فريش,El-cemed toothpaste Cool Fresh,El-cemed,Germany,75,Milliliter (ml),DENTAL KOSMETIK GMBH&COKG,color of life medical Est
2015-0140114-003813, اوبتيما الودنت معجون اسنان اطفال بالفراولة ,Optima AloeDent Toothpaste Childrens with Fluoride,AloeDent,Italy,50,Milliliter (ml),Optima Consumer Health Ltd,AL-DAWAA Medical Services Co.Ltd
2015-0140114-003814,سيلكا هيربال اكستركتس معجون اسنان,Silca Herbal Extracts toothpaste,silca,Germany,100,Milliliter (ml),DENTAL KOSMETIK GMBH&COKG,color of life medical Est
2015-0140114-003816,السي ميد معجون اسنان كرويتر بلس,El-cemed toothpaste krauter plus,el-cemed ,Germany,100,Milliliter (ml),DENTAL KOSMETIK GMBH&COKG,color of life medical Est
2015-0140124-003833,كولي ريفريش ماوث واش,Cooly Refreshing Mouth Wash,Cooly,Egypt,250,Milliliter (ml),Egyption Company For Cosmetic,Mohra Olaythah Mohssen Al-Refaay Establishment
2015-0140124-003837,ماي كير ماوث ووش فايتامين س رينيوال,mycare mouthwash vitamin c renewal,mycare,Turkey,250,Milliliter (ml),SPC Kozmetik ,mohammad wajeeh AL qubbay pharmacy
2015-0140114-003849,اوبتيما الودنت معجون اسنان اطفال بالفراولة,optima AloeDent Children’s Toothpaste strawberry,AloeDent,Italy,50,Milliliter (ml),Optima Consumer Health Ltd,AL-DAWAA Medical Services Co.Ltd
2016-04-001117,اوه !وايت سيلفر وايتنج اكسلييراتور ,oh!white silver whitening accelerator,oh!white,Spain,5,Milliliter (ml),LABORATORIOS ENTEMA S.L.,AL-DAWAA Medical Services Co.Ltd
2016-04-001117,اوه وايت هوم كير دينتال تيش +ستارتير كيت ,Ohwhite home care dental tech+starter kit,Ohwhite,Spain,5,Milliliter (ml),LABORATORIOS ENTEMA S.L.,AL-DAWAA Medical Services Co.Ltd
2016-04-001117,اوه وايت دينتال كلينيج واييبس ,Oh!white dental cleaning wipes,Oh!white,Spain,3,Wipes ,LABORATORIOS ENTEMA S.L.,AL-DAWAA Medical Services Co.Ltd
2016-02-003179,أوباليسينس نظام تبييض الاسنان جيل10%,opalescence tooth whitening gel systems10%,opalescence ,United States,8,Piece,"ultradent products, Inc.",dental era est.
2016-02-003179,أوباليسينس نظام تبييض الاسنان جيل بطيخ 10%,opalescence tooth whitening gel systems melon 10%,opalescence ,United States,8,Piece,"ultradent products, Inc.",dental era est.
2016-02-003179,أوباليسينس نظام تبييض الاسنان جيل بالنعناع10% ,opalescence tooth whitening gel systems mint10%,opalescence ,United States,8,Piece,"ultradent products, Inc.",dental era est.
2016-02-003180,أوباليسينس نظام تبييض الاسنان جيل 20%,opalescence tooth whitening gel systems 20%,opalescence ,United States,8,Piece,"ultradent products, Inc.",dental era est.
