ProductNumber,ProductArName,ProductEnName,BrandName,CounrtyEn,PackageVolume,UnitEn,manufactureenglishname,ListedNameEn
2019-02-018499,125ml أنكور معجون أسنان جل بالمنثول المنعش ,Anchor Toothpaste Cool Menthol Gel 125ml,Anchor,India,125,Milliliter (ml),Anchor Health & Beauty Care Pvt. Ltd,Abdulaziz Altwijri Trading Co.
2019-02-018499,125ml أنكور معجون أسنان جل منعش مع نكهة ,Anchor Toothpaste Tangy Fresh Gel 125ml,Anchor,India,125,Milliliter (ml),Anchor Health & Beauty Care Pvt. Ltd,Abdulaziz Altwijri Trading Co.
2019-02-018499,125ml أنكور معجون أسنان جل ليمون نعناع ,Anchor Toothpaste Lemon Mint Gel 125ml,Anchor,India,125,Milliliter (ml),Anchor Health & Beauty Care Pvt. Ltd,Abdulaziz Altwijri Trading Co.
2019-0140114-165322,سنسوداين معجون اسنان المطورترميم وحماية مع تبييض,Sensodyne toothpaste Advanced Repair&Protect White,Sensodyne,United Kingdom,75,Milliliter (ml),GSK Consumer Healthcare,Glaxo Smithkline Saudi Limited
2019-0140114-165332,سنسوداين معجون اسنان المطور تزميم و حماية,Sensodyne toothpaste Advanced Repair and Protect,SENSODYNE ,United Kingdom,75,Milliliter (ml),GSK Consumer Healthcare,Glaxo Smithkline Saudi Limited
2018-0140114-097315, زيت قرنفل نقي معطر للفم,MULTI-PHARMA PURE CLOVE OIL mouth refreshner,MULTI-PHARMA,Saudi Arabia,30,Milliliter (ml),ABHA COSMETICS AND  MEDICAL PRODUCTS MANUFACTURE,Helath Jewel trading
2018-0140124-097328,غسول للفم,le grand bain Mouthwash,le grand bain,Canada,30,Milliliter (ml),Intros Hotel Supply,Rolaco Hospitality Supplies
2017-0140114-076996,سنسوداين معجون اسنان عناية متعددة + تبييض الاسنان,Sensodyne toothpaste Multi Care + Whitening,Sensodyne,United Arab Emirates,50,Milliliter (ml),Gulf Center Cosmetics Manufacturing L.L.C.,Ahmad Mohammad Abdul Wahab Naghi & Sons. Alnaghi
2017-0140114-077067,معجون أسنان كولجيت برو-ريليف للأسنان الحساسة ترميم,Colgate Toothpaste Sensitive Pro Relief Repair & P,Colgate,Poland,75,Milliliter (ml),COLGATE-PALMOLIVE MANUFACTURING (POLAND) SPÖLKAZ,General Trading Company
2017-0140114-077069,معجون أسنان كولجيت برو-ريليف للأسنان الحساسة ولترم,Colgate Toothpaste Sensitive Pro Relief  Enamel Re,Colgate,Poland,75,Milliliter (ml),COLGATE-PALMOLIVE MANUFACTURING (POLAND) SPÖLKAZ,General Trading Company
2017-0140114-077147,معجون أسنان كولجيت-نكهة عادية رائعة,"Colgate Toothpaste Great Regular Flavour, 100 ml",Colgate,Thailand,100,Fluid ounces (Fl.oz.)  (US),COLGATE-PALMOLIVE (THAILAND) LIMITED,General Trading Company
2019-0140114-165412,سنسوداين معجون اسنان تبييض لطيف ,Sensodyne toothpaste Gentle Whitening ,SENSODYNE ,United Kingdom,100,Milliliter (ml),GSK Consumer Healthcare,Glaxo Smithkline Saudi Limited
2016-0140134Code6-025391,ناتشرزهرت سموكر بودرة تنظيف الاسنان ,Nature's Heart Smoker Whitening Tooth Powder,Nature's Heart,Jordan,45,Gram (g),Muhtaseb Cosmetics Factory,Lips and Eyes trading Est.
2019-0140114-148714,فندق نفلة طقم فرشاه اسنان ,NFLH HOTEL DENTAL KIT,NFLH HOTEL,China,3,Gram (g),Yangzhou Lucky Tourist products Factory,HAND INTERNATIONAL HOTELS RESORTS
2019-0140114-148722,فندق ميركيور  طقم فرشاة اسنان,,MERCURE HOTEL,China,3,Gram (g),Yangzhou Lucky Tourist products Factory,HAND INTERNATIONAL HOTELS RESORTS
2019-0140114-148755,استيرا ستوب,ASTERA PARODONT STOP,Astera,Bulgaria,75,Milliliter (ml),AROMA AD,Hadaiq Alsabar commercial establishment
2019-0140114-148756,استيرا بالفحم النشط,ASTERA PARODONT ACTIVE CHARCOAL,Astera,Bulgaria,75,Milliliter (ml),AROMA AD,Hadaiq Alsabar commercial establishment
2019-04-008728,اورثوكير اسفنج داعم,Orthocare nHAp Boost Sponge,Orthocare Boost Sponge,Netherlands,1,Milliliter (ml),PrevDent International B.V.,MODERN SCIENTIFIC TRADING COMPANY
2019-04-008728,اورثوكير ان اتش ا بي عدة اعادة المعادن,Orthocare nHAp Remineralization Kit,Orthocare Remineralization Kit,Netherlands,77,Gram (g),PrevDent International B.V.,MODERN SCIENTIFIC TRADING COMPANY
2019-04-008728,اورثوكير  مصل الاسنان ,Orthocare nHAp Tooth Serum,Orthocare Tooth Serum,Netherlands,30,Milliliter (ml),PrevDent International B.V.,MODERN SCIENTIFIC TRADING COMPANY
2019-04-008729,معجون أسنان nHAP من بریفدنت,PrevDent nHAp Tooth Serum,PrevDent nHAp Tooth Serum,Netherlands,77,Gram (g),PrevDent International B.V.,MODERN SCIENTIFIC TRADING COMPANY
2019-04-008729,مصل nHAP لإصلاح المينا العناية الفائقة بالفم بريفدنت,PrevDent nHAp Repairing Serum,PrevDent nHAp Repairing Serum,Netherlands,77,Gram (g),PrevDent International B.V.,MODERN SCIENTIFIC TRADING COMPANY
2019-04-008729,ديسنسيدنت لتخفيف الحساسية,DeSensiDent Sensitivity Relief,DeSensiDent Sensitivity Relief kit,Netherlands,77,Gram (g),PrevDent International B.V.,MODERN SCIENTIFIC TRADING COMPANY
2018-0140114-114389,فندق هوليدي جازان طقم فرشاه اسنان ,HOLIDAY JAZAN  HOTED DENTAL KIT,HOLIDAY JAZAN ,China,3,Gram (g),Yangzhou Lucky Tourist products Factory,HAND INTERNATIONAL HOTELS RESORTS
2018-0140114-132151,كلوس اب معجون اسنان ديب اكشن احمر حار,close up toothpaste deep action red hot,CLOSE UP,India,150,Gram (g),Unilever India exports ltd. ,Baray Aljamal Establishment
2016-0140114-025621,أرماندحامر أدفانس وايت بريق رائع جل 115غ,A&H Advance White Brilliant Sparkle Gel 115g,Arm & Hammer (A&H),United Kingdom,115,Gram (g),Church & Dwight UK Ltd,GULF TRADING CORP LTD
2017-0140114-077302,تركيبة بيفرلي هيلز البياض المثالي,Beverly Hills Formula Perfect White toothpaste,Beverly Hills Formula,Ireland,125,Milliliter (ml),Purity Laboratories Ltd,Mohammed Bawazir For Trading Co. Ltd
2017-0140114-077306,معجون أسنان كولجيت برو-ريليف للأسنان الحساسة,Colgate Toothpaste Sensitive Pro Relief Instant Re,Colgate,Poland,75,Milliliter (ml),COLGATE-PALMOLIVE MANUFACTURING (POLAND) SPÖLKAZ,General Trading Company
2018-014015401541-097493,ساشاجوان بودر للعنايه بالشعر,sachajuan volum powder professional haircare,sachajuan ,Sweden,200,Milliliter (ml),sachajuan,National Distribution
2018-014015401541-097493,ساشاجوان بودر للعنايه بالشعر,sachajuan volum powder professional haircare,sachajuan ,Sweden,75,Milliliter (ml),sachajuan,National Distribution
2017-0140114-054030,ماكسدنت معجون الأسنان ,Maxdent Sensitive Max Protect Toothpaste,Maxdent ,Bulgaria,75,Milliliter (ml),STS Holding Group Ltd,alarfaj commercial and imports co
2017-0140114-054065,بيوتي فورميلا معجون أسنان لتبيض الأسنان الحساسة,Beauty Formulas Sensitiv&Gentle WhiteningToothpast,Beauty Formulas,United Kingdom,100,Milliliter (ml),Drammock International Limlited,Hassan S. Al-Amoudi Trd. Est.
2017-0140114-054065,بيوتي فورميلا معجون أسنان لتبيض الأسنان الحساسة,Beauty Formulas Sensitiv&Gentle WhiteningToothpast,Beauty Formulas,United Kingdom,25,Milliliter (ml),Drammock International Limlited,Hassan S. Al-Amoudi Trd. Est.
2017-0140114-054122,معجون أسنان كولجيت حبيبات كريستالية منعشة (ماكس فر,Colgate Max Fresh Spicy Fresh Toothpaste,Colgate,Thailand,100,Milliliter (ml),COLGATE-PALMOLIVE (THAILAND) LIMITED,General Trading Company
2019-0140114-165418,بارودونتكس معجون أسنان حماية متكاملة إنتعاش زائد,Parodontax toothpaste Complete Protection Extra Fresh,Parodontax,Slovakia,75,Milliliter (ml),De Miclen s.r.o.,Glaxo Smithkline Saudi Limited
2019-0140114-165419,سنسوداين معجون أسنان إنتعاش زائد,SENSODYNE TOOTHPASTE EXTRA FRESH,SENSODYNE ,United Arab Emirates,75,Milliliter (ml),Gulf Center Cosmetics Manufacturing L.L.C.,Glaxo Smithkline Saudi Limited
2019-0140114-165438,سنسوداين معجون اسنان مفعول سريع  ,Sensodyne toothpaste Rapid Action,SENSODYNE ,United Kingdom,75,Milliliter (ml),GSK Consumer Healthcare,Glaxo Smithkline Saudi Limited
2019-0140114-165442,سنسوداين معجون اسنان عناية متعددة + تبييض الاسنان,Sensodyne toothpaste Multi Care + Whitening,SENSODYNE ,Egypt,75,Milliliter (ml),EVA Cosmetics Co.,Glaxo Smithkline Saudi Limited
2019-0140114-165443,سنسوداين معجون أسنان مفعول سريع مع تبييض,Sensodyne toothpaste Rapid Action Whitening,SENSODYNE ,United Kingdom,75,Milliliter (ml),GSK Consumer Healthcare,Glaxo Smithkline Saudi Limited
2019-0140114-165444,سيجنال مكافح التسوس, SIGNAL TOOTHPASTE  CAVITY FIGHTER 50ML,Signal,Egypt,50,Milliliter (ml),PREMIER GLOBAL TRADING FZCO,radi ali alsaiari est
2019-0140114-165447,سنسوداين معجون أسنان جل تنظيف عميق,Sensodyne toothpaste Deep Clean Gel,SENSODYNE ,Egypt,75,Milliliter (ml),EVA Cosmetics Co.,Glaxo Smithkline Saudi Limited
2019-0140114-165458,بارودونتكس معجون اسنان انتعاش زائد   ,Parodontax toothpaste Extra Fresh,Parodontax,United Arab Emirates,50,Milliliter (ml),Gulf Center Cosmetics Manufacturing L.L.C.,Glaxo Smithkline Saudi Limited
2019-0140114-165469,سنسوداين معجون أسنان عناية يومية,Sensodyne toothpaste Daily Care,SENSODYNE ,Slovakia,75,Milliliter (ml),De Miclen s.r.o.,Glaxo Smithkline Saudi Limited
2019-0140114-165483,طقم فرشاة اسنان ,MANOLYA DENTAL KIT ,MANOLYA,China,6,Gram (g),Yangzhou Lucky Tourist Products Factory,Majed Zwaid Al Ameeri Est.Br
2019-0140114-165484,طقم فرشاة اسنان,MANOLYA DENTAL KIT ,MANOLYA,China,10,Gram (g),Yangzhou Lucky Tourist Products Factory,Majed Zwaid Al Ameeri Est.Br
2019-0140114-165519,سنسوداين معجون أسنان واقي المينا تبييض لطيف ,Sensodyne Toothpaste Pronamel Gentle Whitening,SENSODYNE ,United Arab Emirates,75,Milliliter (ml),Gulf Center Cosmetics Manufacturing L.L.C.,Glaxo Smithkline Saudi Limited
2019-0140114-165520,بارودونتكس معجون اسنان انتعاش زائد   ,Parodontax toothpaste Extra Fresh,Parodontax,United Arab Emirates,75,Milliliter (ml),Gulf Center Cosmetics Manufacturing L.L.C.,Glaxo Smithkline Saudi Limited
2019-0140114-165522,سنسوداين معجون أسنان واقي المينا إنتعاش أكثر,Sensodyne Toothpaste Pronamel Extra Freshness,SENSODYNE ,United Arab Emirates,75,Milliliter (ml),Gulf Center Cosmetics Manufacturing L.L.C.,Glaxo Smithkline Saudi Limited
2019-0140114-148918,لافونا عدة أسنان,LAVONA DENTAL KIT,LAVONA,China,3,Gram (g),I HOTEL GUEST AMENITIES CO. LTD,Integral Hotel Supplies company Co. LTD
2019-0140114-149016,دينتيوكرال  ديابيتيك توثبيست,DentYucral Diabetic Toothpaste        ,DentYucra,Spain,75,Milliliter (ml),LABORATORIOS VCS FARMA S.L.,Abdullatif Mohammed Salah Jamjoom Co.
2019-0140114-149019,معجون أسنان ميريدول,Meridol Toothpaste,Meridol,Poland,75,Milliliter (ml),COLGATE-PALMOLIVE MANUFACTURING (POLAND) SPÖLKAZ,General Trading Company
2019-0140114-149020,سنسوداين معجون أسنان للحساسية واللثة مع تبييض ,Sensodyne toothpaste Sensitivity & Gum Whitening,Sensodyne,United Kingdom,75,Milliliter (ml),GSK Consumer Healthcare,Ahmad Mohammad Abdul Wahab Naghi & Sons. Alnaghi
2019-04-008750,ابتسامة بودرة تبيض الأسنان ابض و اسود مسحوق سوبر وايت , IBTISAMA BLACK AND WHITE TEETH WHITENING POWDER SET SUPERWHITE POWDER,IBTISAMA,United States,30,Gram (g),IBTISAMA COSMETICS AND MAKEUP TRADING LLC,Fountains Of Youth Establishment
2019-04-008750,ابتسامة ابيض و اسود مسحوق تبيض الأسنان مسحوق الفحم الأسود,IBTISAMA BLACK AND WHITE TEETH WHITENING POWDER SET BLACK CHARCOAL POWDER,IBTISAMA,United States,30,Gram (g),IBTISAMA COSMETICS AND MAKEUP TRADING LLC,Fountains Of Youth Establishment
2019-0140114-149041,ابتسامة شاركول بودر ,IBTISAMA  BLACK CHARCOAL POWDER,IBTISAMA,United States,30,Gram (g),IBTISAMA COSMETICS AND MAKEUP TRADING LLC,Fountains Of Youth Establishment
2019-0140114-165551,سنسوداين معجون اسنان المطورترميم وحمايةانتعاش زائد,Sensodyne toothpaste Advanced Repair & Protect EF,SENSODYNE ,United Kingdom,75,Milliliter (ml),GSK Consumer Healthcare,Glaxo Smithkline Saudi Limited
2019-0140114-165556,سنسوداين معجون اسنان المطور حماية متكاملة انتعاش زائد ,Sensodyne toothpaste AdvancedComplete ProtectionEF,SENSODYNE ,United Kingdom,75,Milliliter (ml),GSK Consumer Healthcare,Glaxo Smithkline Saudi Limited
2019-0140114-165564,سنسوداين معجون أسنان المطورحماية متكاملة  ,Sensodyne toothpaste Advanced Complete Protection,SENSODYNE ,United Kingdom,75,Milliliter (ml),GSK Consumer Healthcare,Glaxo Smithkline Saudi Limited
2019-0140114-165576,إيموفورم للعناية باللثة عبوه مزدوجة,Emoform Gum Care Dou Pack,إيموفورم,Egypt,50,Milliliter (ml),SESIC,Middle East Drug Store
2016-0140124-025778,نيرفاي ويسبرمينت غسول للفم,Nirvae whispermint mouthwash,Nirvae,China,30,Milliliter (ml),Sysco Guest Supply Europe Ltd.,Rolaco Hospitality Supplies
2016-0140114-025826,"فندق قصر الواحة, معجون أسنان, 10غرام","AlWaha Palace,A.ME toothpaste, 10gm",AlWaha Palace,China,10,Gram (g),"JIANGSU SOHO INTERNATIONAL GROUP YANGZHOU CO., LTD",Al soura Al jadeda office for commercial services
2017-04-002941,رويا فرش غسول للفم بنكهة الراولة ,Roya Fresh Mouth Refreshener Strawberry Flavor,Roya Fresh,Egypt,150,Milliliter (ml),Royal Link Pharma,Alsarah Commercial est
2017-04-002941,رويا فرش غسول للفم بنكهة الموز ,Roya Fresh Mouth Refreshener Banana Flavor,Roya Fresh,Egypt,150,Milliliter (ml),Royal Link Pharma,Alsarah Commercial est
2017-0140114-054272,(نانو كير معجون أسنان بالنانو تكنولوجي ( الفضة,NanoCare Nanosilver Toothpaste,NanoCare,South Korea,50,Gram (g),Nanogist Co. Ltd,Ard alhijaz for AGRI. AND TRADE.
2017-0140114-054304,روكس معجون اسنان بالكالسيوم النشط,ROCS active Calcium Toothpaste,ROCS,Russia,75,Milliliter (ml),DRC Global Ltd,Branch of Abdul Aziz Mesfer Al Asmary for Trading
2018-0140134Code6-097605,بيررو معجون مبيض للأسنان، 75 مل,"PIERROT WHITENING TOOTHPASTE, 75ml",Pierrot,Spain,75,Milliliter (ml),"FUSHIMA, Laboratorios Cosmodent, S.A.",Al-Zawra'a Trading Establishment
2016-0140114-025993,تشو تشو اي لوف يو,Chou Chou I Love You,LUSH,United Kingdom,50,Gram (g),Lush Manufacturing Limited,alsaati medical grup
2016-0140114-026051,كولجيت معجون أسنان  برو-ريليف للأسنان الحساسة,Colgate Toothpaste  Sensitive Pro Relief ,Colgate,Poland,75,Milliliter (ml),COLGATE-PALMOLIVE MANUFACTURING (POLAND) SPÖLKAZ,General Trading Company
2016-0140124-026093,جلينوفا ، غسول فم ، الاركاتك المنعش,"GLENOVA, MOUTH WASH, ARCTIC FRESH",GLENOVA,Italy,400,Milliliter (ml),CONER s.r.l,Khair Hajar Medical Store
2016-0140114-026136,جيم بودرة لتنظيف الاسنان,GEM NEW BLACK NEEM TOOTH POWDER,GEM,Bangladesh,50,Milligram )mg(,chowdhury trade international,IBRAHIM MAQBOOL KHAIRALLAH
2019-0140124-149120,استيرا الفحم النشط, ASTERA CHARCOAL,Astera,Bulgaria,300,Milliliter (ml),AROMA AD,Hadaiq Alsabar commercial establishment
2019-0140114-149317,استيرا املاح البحر الميت, ASTERA PARODONT BLACK SEA LYE ,Astera,Bulgaria,75,Milliliter (ml),AROMA AD,Hadaiq Alsabar commercial establishment
2019-014015401541-149347,عود مرغوب,OUD MARGHOOB,DEHNEE PERFUME FACTORY,United Arab Emirates,100,Milliliter (ml), DEHNEE PERFUME FACTORY,NAJMAT AL-EMIRAT TRADING EST.
2018-0140134Code6-114598,كوارابكس بلاك از وايت,CURAPROX BLACK IS WHITE,CURAPROX ,Switzerland,90,Milligram )mg(,CURADEN AG,alhamaed medical & trading company ltd
2018-0140114-114640,سيجنال متكامل 8 مبيض ,SIGNAL Tooth Paste COMPLETE 8 WHITE,Signal,Egypt,100,Milliliter (ml),Unilever Mashreq for personal care,SAID MOHAMMED OBAID BINZAGR
2017-0140134Code6-077818,فيليبس زووم نايت وايت,Philips Zoom NiteWhite 16% Carbamide Peroxide,فيليبس زووم نايت وايت,United States,6,Prefiiled Trays,".Discus Dental, LLC",Medical and Pharmaceutical Services Co.
2017-0140114-077829,لاسير جل الأسنان لاسير جونيور,Lacer toothgel Lacer junior,Lacer,Spain,75,Milliliter (ml),"LACER, S.A",Thimar AlJazirah Company
2017-0140114-077872,معجون أسنان كولجيت ناتشورال اكستراكتس أقوي إنتعاش,Colgate Toothpaste Natural Extracts Ultimate Fresh,Colgate,China,75,Milliliter (ml),Colgate Palmolive (China) Company Limited,General Trading Company
2017-0140124-077887,تركيبة بيفرلي هيلز غسول للفم منعش ومبيض,Beverly Hills Formula Total Breath Whitening Mouth,Beverly Hills Formula,Ireland,500,Milliliter (ml),Purity Laboratories Ltd,Mohammed Bawazir For Trading Co. Ltd
2017-014015401541-054555,جيليت رغوة للحلاقة نعناع,Gillette Foam Menthol,GILLETTE,United Kingdom,200,Milliliter (ml), Gillette Reading UK,Ahmad Mohammad Abdul Wahab Naghi & Sons. Alnaghi
2017-014015401541-054564,جيليت رغوة للحلاقة عادي,Gillette Foam Regular,GILLETTE,United Kingdom,200,Milliliter (ml), Gillette Reading UK,Ahmad Mohammad Abdul Wahab Naghi & Sons. Alnaghi
2017-0140124-054629,اس. تاناي سانسيت بيتش ماوس ووش للفم,S. Tanay Sunset Beach Mouth Wash ,S. Tanay,Turkey,53,Milliliter (ml),Tanay Turizm Otelcilik Ekipmanları Dış Tic.Ltd. Şt,Rodana International Treading Company
2019-0140114-165659,بارودونتكس معجون اسنان بالفلورايد,Parodontax toothpaste Fluoride,Parodontax,United Arab Emirates,75,Milliliter (ml),Gulf Center Cosmetics Manufacturing L.L.C.,Glaxo Smithkline Saudi Limited
2019-0140124-165670,سنسوداين غسول فم انتعاش زائد,Sensodyne mouthwash Extra Fresh,SENSODYNE ,United Kingdom,500,Milliliter (ml),GSK Consumer Healthcare,Glaxo Smithkline Saudi Limited
2019-0140114-165676,بارودونتكس معجون اسنان نظافة فائقة,Parodontax toothpaste Ultra Clean,Parodontax,United Arab Emirates,75,Milliliter (ml),Gulf Center Cosmetics Manufacturing L.L.C.,Glaxo Smithkline Saudi Limited
2019-0140114-165707,سنسوداين معجون اسنان إنتعاش زائد,Sensodyne Toothpaste Extra Fresh,SENSODYNE ,United Arab Emirates,50,Milliliter (ml),Gulf Center Cosmetics Manufacturing L.L.C.,Glaxo Smithkline Saudi Limited
2019-0140114-165720,سنسوداين معجون اسنان عناية متعددة + تبييض الاسنان,Sensodyne toothpaste Multi Care+Whitening,SENSODYNE ,United Arab Emirates,50,Milliliter (ml),Gulf Center Cosmetics Manufacturing L.L.C.,Glaxo Smithkline Saudi Limited
2019-0140114-165741,سنسوداين معجون اسنان بالفلورايد  ,Sensodyne Toothpaste Fluoride,SENSODYNE ,Egypt,75,Milliliter (ml),EVA Cosmetics Co.,Glaxo Smithkline Saudi Limited
2019-0140114-165755,أكوافريش معجون أسنان بياض ناصع,Aquafresh Toothpaste Intense White,Aquafresh,United Kingdom,125,Milliliter (ml),GSK Consumer Healthcare,Glaxo Smithkline Saudi Limited
2019-0140114-165756,سنسوداين معجون اسنان عادي,Sensodyne toothpaste Original,SENSODYNE ,Egypt,75,Milliliter (ml),EVA Cosmetics Co.,Glaxo Smithkline Saudi Limited
2019-0140114-165763,بارودونتكس معجون اسنان بالأعشاب,Parodontax toothpaste Herbal,Parodontax,Slovakia,50,Milliliter (ml),De Miclen s.r.o.,Glaxo Smithkline Saudi Limited
2019-0140114-165767,أكوافريش معجون أسنان الأسنان الكبيرة,Aquafresh Toothpaste Big Teeth,Aquafresh,Slovakia,50,Milliliter (ml),De Miclen s.r.o.,Glaxo Smithkline Saudi Limited
2019-0140114-165771,أكوافريش معجون أسنان الأسنان اللبنية,Aquafresh Toothpaste Milk Teeth,Aquafresh,Slovakia,50,Milliliter (ml),De Miclen s.r.o.,Glaxo Smithkline Saudi Limited
2019-0140114-165773,أكوافريش معجون أسنان الأسنان الصغيرة,Aquafresh Toothpaste Little Teeth,Aquafresh,Slovakia,50,Milliliter (ml),De Miclen s.r.o.,Glaxo Smithkline Saudi Limited
2019-0140114-165788,سنسوداين معجون اسنان ترو وايت نعناع ,Sensodyne toothpaste True White Mint,SENSODYNE ,United Arab Emirates,75,Milliliter (ml),Gulf Center Cosmetics Manufacturing L.L.C.,Glaxo Smithkline Saudi Limited
2019-0140114-165789,أكوافريش معجون أسنان منعش وبنكهة النعناع,Aquafresh Toothpaste Fresh & Minty,Aquafresh,Slovakia,125,Milliliter (ml),De Miclen s.r.o.,Glaxo Smithkline Saudi Limited
2019-0140114-165808,بارودونتكس معجون اسنان الاصلي ,Parodontax toothpaste Original,Parodontax,United Arab Emirates,75,Milliliter (ml),Gulf Center Cosmetics Manufacturing L.L.C.,Glaxo Smithkline Saudi Limited
2019-0140124-165815,بارودونتكس غسول الفم اليومي ,Parodontax Mouthwash Daily,Parodontax,Germany,300,Milliliter (ml),Omega Pharma Manufacturing GmbH Co. KG,Glaxo Smithkline Saudi Limited
2019-0140114-165820,أكوافريش معجون أسنان لطيف وبنكهة النعناع,Aquafresh Toothpaste Mild & Minty,Aquafresh,Slovakia,125,Milliliter (ml),De Miclen s.r.o.,Glaxo Smithkline Saudi Limited
2019-0140114-165860,سنسوداين معجون اسنان عناية متعددة + تبييض الاسنان,Sensodyne toothpaste Multi Care + Whitening,SENSODYNE ,Egypt,75,Milliliter (ml),EVA Cosmetics Co.,Glaxo Smithkline Saudi Limited
2019-0140114-165864,سنسوداين معجون أسنان جل تنظيف عميق,Sensodyne toothpaste Deep Clean Gel,SENSODYNE ,Egypt,100,Milliliter (ml),GSK Consumer Healthcare,Glaxo Smithkline Saudi Limited
2016-0140114-026209,فورملا أكشن معجون أسنان, Formula Toothpaste Action Protector,Formula ,Indonesia,75,Gram (g),PEPPER SION PTE. LTD,SILVER PHOENIX TRADING .EST
2016-0140114-026209,فورملا أكشن معجون أسنان, Formula Toothpaste Action Protector,Formula ,Indonesia,190,Gram (g),PEPPER SION PTE. LTD,SILVER PHOENIX TRADING .EST
2016-0140114-026236,فورملا سترونق معجون أسنان,Formula Toothpaste Strong,Formula ,Indonesia,65,Gram (g),PEPPER SION PTE. LTD,SILVER PHOENIX TRADING .EST
2016-0140114-026236,فورملا سترونق معجون أسنان,Formula Toothpaste Strong,Formula ,Indonesia,160,Gram (g),PEPPER SION PTE. LTD,SILVER PHOENIX TRADING .EST
2016-0140114-026237,فورملا كونفيدينت معجون أسنان,Formula Toothpaste Confident,Formula ,Indonesia,65,Gram (g),PEPPER SION PTE. LTD,SILVER PHOENIX TRADING .EST
2016-0140114-026237,فورملا كونفيدينت معجون أسنان,Formula Toothpaste Confident,Formula ,Indonesia,160,Gram (g),PEPPER SION PTE. LTD,SILVER PHOENIX TRADING .EST
2016-0140114-026239,فورملا سينسيتيف معجون أسنان,Formula Toothpaste Sensitive,Formula ,Indonesia,100,Gram (g),PEPPER SION PTE. LTD,SILVER PHOENIX TRADING .EST
2016-0140114-026272,سيميلي ماوث جل,Seemly Mouth Gel ,Seemly,Egypt,30,Gram (g),Egyptian Company for Cosmetic,life fragrant
2016-0140114-026314,مورملا سباركلينق وايت,Formula Toothpaste Sparkling White,Formula ,Indonesia,75,Gram (g),PEPPER SION PTE. LTD,SILVER PHOENIX TRADING .EST
2016-0140114-026314,مورملا سباركلينق وايت,Formula Toothpaste Sparkling White,Formula ,Indonesia,190,Gram (g),PEPPER SION PTE. LTD,SILVER PHOENIX TRADING .EST
2017-0140124-077999,دابر الأعشاب الليمون المبيض غسول الفم,Dabur Herb'l Lime Mouthwash Whitening,Dabur Herb'l,United Arab Emirates,250,Milliliter (ml),Naturelle LLc,ARAB TRADING -TAMER GROUP
2017-0140124-078000,دابر الأعشاب النيم غسول الفم,Dabur Herb'l Neem Mouthwash Antibacterial,Dabur Herb'l,United Arab Emirates,250,Milliliter (ml),Naturelle LLc,ARAB TRADING -TAMER GROUP
2017-0140114-078044,زيت القرنفل من هيماني,Hemani Clove  Oil,hemani,Pakistan,30,Milliliter (ml),HEMANI INTERNATIONAL PVT LTD,"abdalmoneim almarwani&sons,co,lid"
2017-0140124-078052,سانجر أوكلسيفا غسول للفم,Sangre Oclusiva Mouth Gargle,Sangre Oclusiva,India,150,Milliliter (ml),Themis Medicare,Alsawah drug store company
2017-02-005120,روكس معجون اسنان  للاطفال بطعم العلكة,ROCS Toothpaste with bubble gum flavor,ROCS,Russia,35,Milliliter (ml),DRC Global Ltd,Branch of Abdul Aziz Mesfer Al Asmary for Trading
2017-02-005120,روكس معجون اسنان للاطفال بطعم التوت والفراولة,ROCS with Raspberry & Strawberry,ROCS,Russia,35,Milliliter (ml),DRC Global Ltd,Branch of Abdul Aziz Mesfer Al Asmary for Trading
2017-0140114-054763,معجون أسنان سييملى ,Seemly Toothpaste ,Seemly ,Egypt,120,Gram (g),egyption co. for cosmetics,bait alhomaid trading est.
2017-014015401541-054771,جامي، جل اللثة والأسنان للكبار,"Gummy, Gel for adults gum and teeth",Gummy,Germany,30,Gram (g),Artefactum gmbh francois ,Bonn Healthcare
